{
  "$schema": "http://json-schema.org/draft-07/schema#",
  "title": "claude-code-harness Configuration",
  "description": "Configuration schema for claude-code-harness safety and behavior settings",
  "type": "object",
  "properties": {
    "version": {
      "type": "string",
      "description": "Config version for compatibility",
      "default": "1.0"
    },
    "safety": {
      "type": "object",
      "description": "Safety controls for dangerous operations",
      "properties": {
        "mode": {
          "type": "string",
          "enum": ["dry-run", "apply-local", "apply-and-push"],
          "default": "dry-run",
          "description": "Operation mode: dry-run (show what would happen), apply-local (make changes but no push), apply-and-push (full automation - requires explicit enable)"
        },
        "require_confirmation": {
          "type": "boolean",
          "default": true,
          "description": "Require user confirmation before destructive operations"
        },
        "max_auto_retries": {
          "type": "integer",
          "minimum": 0,
          "maximum": 5,
          "default": 3,
          "description": "Maximum automatic retry attempts before escalation"
        }
      },
      "default": {}
    },
    "git": {
      "type": "object",
      "description": "Git operation controls",
      "properties": {
        "allow_auto_commit": {
          "type": "boolean",
          "default": false,
          "description": "Allow automatic git commits without confirmation"
        },
        "allow_auto_push": {
          "type": "boolean",
          "default": false,
          "description": "Allow automatic git push without confirmation (requires allow_auto_commit)"
        },
        "protected_branches": {
          "type": "array",
          "items": { "type": "string" },
          "default": ["main", "master", "production"],
          "description": "Branches where auto-push is never allowed"
        },
        "commit_prefix": {
          "type": "string",
          "default": "fix:",
          "description": "Prefix for auto-generated commit messages"
        }
      },
      "default": {}
    },
    "paths": {
      "type": "object",
      "description": "Path restrictions for file operations",
      "properties": {
        "allowed_modify": {
          "type": "array",
          "items": { "type": "string" },
          "default": ["src/", "app/", "components/", "lib/", "pages/", "Plans.md", "AGENTS.md", "CLAUDE.md"],
          "description": "Paths that can be modified (glob patterns supported)"
        },
        "protected": {
          "type": "array",
          "items": { "type": "string" },
          "default": [".github/", ".gitlab/", "infra/", "k8s/", "terraform/", ".env", ".env.*", "credentials/", "secrets/"],
          "description": "Paths that are never modified automatically"
        },
        "plans_file": {
          "type": "string",
          "default": "Plans.md",
          "description": "Path to the plans/task file"
        },
        "agents_file": {
          "type": "string",
          "default": "AGENTS.md",
          "description": "Path to the agents configuration file"
        }
      },
      "default": {}
    },
    "ci": {
      "type": "object",
      "description": "CI/CD integration settings",
      "properties": {
        "provider": {
          "type": "string",
          "enum": ["github_actions", "gitlab_ci", "circleci", "none", "auto"],
          "default": "auto",
          "description": "CI provider (auto = detect from config files)"
        },
        "enable_auto_fix": {
          "type": "boolean",
          "default": false,
          "description": "Enable automatic CI error fixing (dangerous - requires explicit enable)"
        },
        "require_gh_cli": {
          "type": "boolean",
          "default": true,
          "description": "Require gh CLI for GitHub Actions operations"
        }
      },
      "default": {}
    },
    "scaffolding": {
      "type": "object",
      "description": "Project scaffolding settings",
      "properties": {
        "tech_choice_mode": {
          "type": "string",
          "enum": ["auto", "ask", "fixed"],
          "default": "ask",
          "description": "How to handle technology choices: auto (AI decides), ask (always ask user), fixed (use preset stack)"
        },
        "base_stack": {
          "type": "string",
          "description": "Preset technology stack when tech_choice_mode is 'fixed' (e.g., 'next-supabase', 'rails-postgres', 'express-mongodb')"
        },
        "allow_web_search": {
          "type": "boolean",
          "default": true,
          "description": "Allow web search for technology recommendations"
        },
        "templates": {
          "type": "object",
          "description": "Custom template overrides",
          "additionalProperties": { "type": "string" }
        }
      },
      "default": {}
    },
    "destructive_commands": {
      "type": "object",
      "description": "Controls for potentially destructive commands",
      "properties": {
        "allow_rm_rf": {
          "type": "boolean",
          "default": false,
          "description": "Allow rm -rf commands (node_modules, etc.)"
        },
        "allow_npm_install": {
          "type": "boolean",
          "default": true,
          "description": "Allow npm install commands"
        },
        "require_size_check": {
          "type": "boolean",
          "default": true,
          "description": "Check project size before destructive operations"
        },
        "max_files_to_modify": {
          "type": "integer",
          "default": 20,
          "description": "Maximum number of files that can be modified in one operation"
        }
      },
      "default": {}
    },
    "i18n": {
      "type": "object",
      "description": "Internationalization settings / 国際化設定",
      "properties": {
        "language": {
          "type": "string",
          "enum": ["en", "ja"],
          "default": "en",
          "description": "Display language for commands and messages (en: English, ja: Japanese / 日本語)"
        }
      },
      "default": {}
    },
    "constitution": {
      "type": "object",
      "description": "Constitution file settings / 開発原則設定",
      "properties": {
        "path": {
          "type": "string",
          "default": "docs/constitution.md",
          "description": "Path to the constitution file (quality gates, DoD, principles)"
        }
      },
      "default": {}
    },
    "runtimefloor": {
      "type": "object",
      "description": "Runtime action hard floor declarations / 実行時 hard floor 宣言",
      "properties": {
        "secretAllow": {
          "type": "array",
          "items": { "type": "string" },
          "default": [],
          "description": "Project-local secret-read path declarations. Relative paths are resolved under the project root; absolute paths outside the project are ignored."
        }
      },
      "default": {}
    },
    "orchestration": {
      "type": "object",
      "description": "Deterministic orchestration settings / 決定論的オーケストレーション設定",
      "properties": {
        "state_machine_version": {
          "type": "string",
          "default": "v1",
          "description": "Version tag for the session state machine specification"
        },
        "max_state_retries": {
          "type": "integer",
          "minimum": 0,
          "maximum": 10,
          "default": 3,
          "description": "Max retries per state before escalation"
        },
        "retry_backoff_seconds": {
          "type": "integer",
          "minimum": 0,
          "maximum": 600,
          "default": 10,
          "description": "Backoff seconds between state retries"
        }
      },
      "default": {}
    },
    "work": {
      "type": "object",
      "description": "/work command behavior settings",
      "properties": {
        "auto_commit": {
          "type": "boolean",
          "default": true,
          "description": "Enable auto-commit after review approval"
        },
        "commit_on_pm_approve": {
          "type": "boolean",
          "default": false,
          "description": "Defer commit until PM approves in 2-Agent mode. When true, /work skips auto-commit and includes commit instruction in the handoff. PM's approve triggers commit via the next /work invocation. Ignored in Solo mode."
        }
      },
      "default": {}
    },
    "session": {
      "type": "object",
      "description": "Session persistence and resume/fork settings",
      "properties": {
        "snapshot_path": {
          "type": "string",
          "default": ".claude/state/session.json",
          "description": "Path to the session snapshot file"
        },
        "event_log_path": {
          "type": "string",
          "default": ".claude/state/session.events.jsonl",
          "description": "Path to the session event log (JSONL)"
        },
        "resume_policy": {
          "type": "string",
          "enum": ["auto", "manual", "disabled"],
          "default": "auto",
          "description": "Resume behavior when a previous session is detected"
        },
        "fork_policy": {
          "type": "string",
          "enum": ["manual", "auto_on_conflict", "disabled"],
          "default": "manual",
          "description": "Fork behavior when conflicting state is detected"
        }
      },
      "default": {}
    },
    "quality_pack": {
      "type": "object",
      "description": "Optional quality automation pack (PostToolUse). Keys mirror posttooluse_quality_pack.go's readQualityPackConfig (previously informal/undocumented).",
      "properties": {
        "enabled": {
          "type": "boolean",
          "default": false,
          "description": "Enable the quality pack"
        },
        "mode": {
          "type": "string",
          "enum": ["warn", "run"],
          "default": "warn",
          "description": "warn: print a recommendation only. run: execute the check (e.g. prettier --write)"
        },
        "prettier": {
          "type": "boolean",
          "default": true,
          "description": "Enable the Prettier check"
        },
        "tsc": {
          "type": "boolean",
          "default": true,
          "description": "Enable the tsc --noEmit check"
        },
        "console_log": {
          "type": "boolean",
          "default": true,
          "description": "Enable the console.log detection check"
        }
      },
      "default": {}
    },
    "writing_lint": {
      "type": "object",
      "description": "Japanese writing-style lint (PostToolUse dictionary scan + Stop re-scan). Keys mirror posttooluse_writing_lint.go's readWritingLintConfig and writinglint.ResolveDictPath.",
      "properties": {
        "enabled": {
          "type": "boolean",
          "default": false,
          "description": "Enable writing-lint (default off)"
        },
        "scene": {
          "type": "string",
          "default": "",
          "description": "Scene key used to narrow which dictionary rules apply (Rule.AppliesToScene). Empty means no narrowing: every enabled rule runs, and rules with an empty scenes list always apply. The code-comment scene is a stretch goal and out of scope for the current implementation."
        },
        "structural": {
          "type": "boolean",
          "default": true,
          "description": "Enable structural checks (3+ consecutive identical sentence endings, polite/plain style mixing)"
        },
        "dict_path": {
          "type": "string",
          "description": "Writing-rule.v1 JSONL dictionary path, resolved relative to the project root. Precedence: this key > env CLAUDE_WRITING_LINT_DICT > ~/.claude/writing-lint/rules.jsonl."
        }
      },
      "default": {}
    }
  },
  "additionalProperties": false
}
