{
  "$schema": "./claude-code-harness.config.schema.json",
  "version": "1.0",

  "i18n": {
    "language": "en",
    "comment": "en: English default / ja: Japanese opt-in - keep generated files, docs, and messages aligned"
  },

  "constitution": {
    "path": "docs/constitution.md",
    "comment": "品質ゲート・DoD・原則を集約したファイル（プロジェクトごとにカスタマイズ可）"
  },

  "runtimefloor": {
    "secretAllow": [
      ".env.local",
      "secrets/pipeline.key"
    ],
    "comment": "secret-read の事前宣言。相対 path は project root 配下として解決され、project 外の絶対 path は無効化されます。"
  },

  "work": {
    "auto_commit": true,
    "commit_on_pm_approve": false,
    "comment": "commit_on_pm_approve: true にすると 2-Agent モードで PM 承認後にコミット"
  },

  "safety": {
    "mode": "dry-run",
    "require_confirmation": true,
    "max_auto_retries": 3
  },

  "git": {
    "allow_auto_commit": false,
    "allow_auto_push": false,
    "protected_branches": ["main", "master", "production"],
    "commit_prefix": "fix:",
    "comment": "protected_branches は R11/R12 ガードレールで強制（組込みの main/master に追加）。allow_auto_* と commit_prefix は skill 側のヒント。"
  },

  "paths": {
    "allowed_modify": [
      "src/",
      "app/",
      "components/",
      "lib/",
      "pages/",
      "Plans.md",
      "AGENTS.md",
      "CLAUDE.md"
    ],
    "protected": [
      ".github/",
      ".gitlab/",
      "infra/",
      "k8s/",
      "terraform/",
      ".env",
      ".env.*",
      "credentials/",
      "secrets/"
    ],
    "plans_file": "Plans.md",
    "agents_file": "AGENTS.md",
    "comment": "protected は R16 ガードレールで Write/Edit/MultiEdit を deny（宣言したパスのみ・緩和はしない）。このファイルを実際に読ませるには .claude-code-harness.config.json として保存する。"
  },

  "ci": {
    "provider": "auto",
    "enable_auto_fix": false,
    "require_gh_cli": true
  },

  "scaffolding": {
    "tech_choice_mode": "ask",
    "allow_web_search": true
  },

  "destructive_commands": {
    "allow_rm_rf": false,
    "allow_npm_install": true,
    "require_size_check": true,
    "max_files_to_modify": 20,
    "comment": "allow_rm_rf: true にすると R05 の rm -rf 確認を抑止（既定 false）。worktree 外の削除は runtimefloor のハード floor で引き続き停止。allow_npm_install / require_size_check / max_files_to_modify は skill 側のヒント。"
  }
}
